{
  "$schema": "../../docs/zh_cn/schemas/part_definition_schema.json",
  "icon": "machine_max:textures/icon/senna_gtr/senna_gtr_door_icon.png",
  "vehicle_durability_rate": 1.0,
  "vehicle_damage_rate": 0.5,
  "vehicle_damage_rate_destroyed": 0.1,
  "max_stack_size": 2,
  "variants": {
    "left": {
      "model": "machine_max:senna_gtr_door_left.geo",
      "textures": "machine_max:textures/part/senna_gtr/senna_gtr.png",
      "animations": "machine_max:empty",
      "tags": ["machine_max:door", "machine_max:senna_gtr", "machine_max:left"],
      "sub_parts": {
        "sub_part.machine_max.main": {
          "durability": 50.0,
          "mass": 35.0,
          "block_collision": "ground",
          "collision_height": 1.5,
          "hit_boxes": {
            "Collision": {
              "type": "box",
              "material": "machine_max:7035_aluminum_alloy"
            }
          },
          "connectors": {
            "connector.machine_max.axis": {
              "locator": "left_door_hull_axis",
              "definition": "machine_max:fixed_down",
              "overwrite": {
                "integrity": 5
              }
            },
            "connector.machine_max.lock": {
              "locator": "left_door_hull_lock",
              "definition": "machine_max:fixed_down"
            }
          },
          "projected_area": [0.19, 1.04, 0.29],
          "hydrodynamics": {
            "": {
              "front_drag": [0.1, 0.1],
              "back_drag": [0.1, 0.1]
            }
          }
        }
      }
    },
    "right": {
      "model": "machine_max:senna_gtr_door_right.geo",
      "textures": "machine_max:textures/part/senna_gtr/senna_gtr.png",
      "animations": "machine_max:empty",
      "tags": ["machine_max:door", "machine_max:senna_gtr", "machine_max:right"],
      "sub_parts": {
        "sub_part.machine_max.main": {
          "durability": 50.0,
          "mass": 35.0,
          "block_collision": "ground",
          "collision_height": 1.5,
          "hit_boxes": {
            "Collision": {
              "type": "box",
              "material": "machine_max:7035_aluminum_alloy"
            }
          },
          "connectors": {
            "connector.machine_max.axis": {
              "locator": "right_door_hull_axis",
              "definition": "machine_max:fixed_down"
            },
            "connector.machine_max.lock": {
              "locator": "right_door_hull_lock",
              "definition": "machine_max:fixed_down",
              "overwrite": {
                "integrity": 5
              }
            }
          },
          "projected_area": [0.19, 1.04, 0.29],
          "hydrodynamics": {
            "": {
              "front_drag": [0.1, 0.1],
              "back_drag": [0.1, 0.1]
            }
          }
        }
      }
    }
  }
}