{
  "$schema": "../../docs/zh_cn/schemas/part_definition_schema.json",
  "icon": "machine_max:textures/icon/senna_gtr/senna_gtr_hull_icon.png",
  "vehicle_durability_rate": 0.6,
  "vehicle_damage_rate": 1.0,
  "vehicle_damage_rate_destroyed": 0.1,
  "variants": {
    "front": {
      "model": "machine_max:senna_gtr_front_hull.geo",
      "textures": "machine_max:textures/part/senna_gtr/senna_gtr.png",
      "animations": "machine_max:senna_gtr",
      "tags": ["machine_max:hull", "machine_max:senna_gtr", "machine_max:front"],
      "sub_parts": {
        "sub_part.machine_max.main": {
          "durability": 120.0,
          "mass": 50.0,
          "block_collision": "ground",
          "collision_height": 1.5,
          "hit_boxes": {
            "Collision": {
              "id": "part",
              "type": "box",
              "material": "machine_max:7035_aluminum_alloy"
            }
          },
          "connectors": {
            "connector.machine_max.chassis_front": {
              "locator": "hull_chassis_front",
              "definition": "machine_max:fixed_down"
            },
            "connector.machine_max.left_door_axis": {
              "locator": "hull_left_door_axis",
              "definition": "machine_max:senna_gtr_left_door_axis"
            },
            "connector.machine_max.right_door_axis": {
              "locator": "hull_right_door_axis",
              "definition": "machine_max:senna_gtr_right_door_axis"
            }
          },
          "projected_area": [4.6, 6.9, 5.5],
          "hydro_priority": 10,
          "hydrodynamics": {
            "": {
              "front_drag": [0.1, 0.1],
              "back_drag": [0.1, 0.0]
            }
          }
        }
      }
    },
    "back": {
      "model": "machine_max:senna_gtr_back_hull.geo",
      "textures": "machine_max:textures/part/senna_gtr/senna_gtr.png",
      "animations": "machine_max:senna_gtr",
      "tags": ["machine_max:hull", "machine_max:senna_gtr", "machine_max:back"],
      "sub_parts": {
        "sub_part.machine_max.main": {
          "durability": 120.0,
          "mass": 50.0,
          "block_collision": "ground",
          "collision_height": 1.5,
          "hit_boxes": {
            "Collision": {
              "id": "part",
              "type": "box",
              "material": "machine_max:7035_aluminum_alloy"
            }
          },
          "connectors": {
            "connector.machine_max.chassis_back": {
              "locator": "hull_chassis_back",
              "definition": "machine_max:fixed_down"
            },
            "connector.machine_max.left_door_lock": {
              "locator": "hull_left_door_lock",
              "definition": "machine_max:fixed_up"
            },
            "connector.machine_max.right_door_lock": {
              "locator": "hull_right_door_lock",
              "definition": "machine_max:fixed_up"
            }
          },
          "projected_area": [4.6, 6.9, 5.5],
          "hydro_priority": 10,
          "hydrodynamics": {
            "": {
              "front_drag": [0.1, 0.05],
              "back_drag": [0.1, 0.1],
              "y_lift": -0.001
            }
          }
        }
      }
    }
  }
}