{
  "$schema": "../../docs/zh_cn/schemas/part_definition_schema.json",
  "icon": "machine_max:textures/icon/ae86/ae86_armor_icon.png",
  "vehicle_durability_rate": 1.0,
  "vehicle_damage_rate": 0.1,
  "vehicle_damage_rate_destroyed": 0.1,
  "variants": {
    "model": "machine_max:ae86_armor.geo",
    "textures": {
      "default": "machine_max:textures/part/ae86/ae86_armor.png"
    },
    "tags": ["machine_max:ae86"],
    "sub_parts": {
      "sub_part.machine_max.main": {
        "durability": 1200.0,
        "mass": 10.0,
        "block_collision": "true",
        "collision_height": 0,
        "hit_boxes": {
          "collision_armor": {
            "type": "box",
            "material": "machine_max:structural_steel",
            "thickness": 5
          }
        },
        "connectors": {
          "connector.machine_max.front_armor": {
            "locator": "front_armor",
            "definition": "machine_max:fixed_down"
          }
        }
      }
    }
  }
}